{
  "$comment": "Provisional manifest — formalized by the Media entity schema (history-alive-y0u.2). STATUS: HOLD — see colorization.status.",
  "id": "media:person/hentsch-richard/portrait-colorized",
  "person": "person:hentsch-richard",
  "file": "portrait-colorized.png",
  "width": 1048,
  "height": 1501,
  "colorized": true,
  "original": {
    "description": "Catalogue title (Landesarchiv BW): 'Richard Hentsch, Oberst und Generalstabschef Militärverwaltung Rumäniens, stehend in Uniform mit Orden hinter Schreibtisch, Brustbild in Halbprofil' — standing in uniform with orders behind a desk, bust-length in half-profile; mounted photograph 19.5 × 13 cm with mourning border, 1918.",
    "photographer": "not identified (from the estate of Dr. Johannes Friedrich Rudolph von Goetz, 1856–1941, military physician)",
    "date": "1918",
    "archive": "Landesarchiv Baden-Württemberg, Hauptstaatsarchiv Stuttgart, Militärhistorische Bildsammlung, M 703 R959N4 — via Deutsche Digitale Bibliothek and Wikimedia Commons",
    "archive_url": "https://commons.wikimedia.org/wiki/File:Richard_Hentsch.jpg",
    "archive_item_url": "https://www.deutsche-digitale-bibliothek.de/item/PRAWRWVVS3PB4HFQ3OS44WVL5CYCIET5",
    "original_dimensions": "387 × 600 (Commons copy of a 19.5 × 13 cm print)",
    "licence": "CC-BY 3.0 DE (attribution: Landesarchiv Baden-Württemberg, HStA Stuttgart M 703 R959N4) and public domain in the US (pre-1931)"
  },
  "colorization": {
    "author": "Dave Tashner / History Alive",
    "method": "AI-assisted colorization from the original, 2026",
    "licence": "History Alive project licence with CC-BY attribution to the Deutsche Digitale Bibliothek",
    "status": "HOLD (narrowed) — the archive catalogue confirms the desk and the standing pose are in the original, so the setting is not invented. It also describes the print as 'Brustbild' (bust-length), whereas the colorized image runs to the hips with hands on the table and a wall of maps behind — so confirm by a side-by-side glance that the lower half and background were not AI-extended. If they were, re-render colour-only at the original crop. Policy: colour only (history-alive-y0u.1)."
  },
  "content_policy": "ok — portrait, no gore",
  "caption": "Richard Hentsch (1869–1918), Oberstleutnant of the General Staff — sent by Moltke on 8 September 1914 to tour the army headquarters with authority to order a retreat; his visit to Bülow and Kluck on 8–9 September ended the German advance at the Marne. Photographed in 1918. Colorized (AI-assisted).",
  "credit": "Original photograph: J. F. R. von Goetz, 1918, Deutsche Digitale Bibliothek, CC-BY 3.0 (via Wikimedia Commons). Colorization: History Alive, AI-assisted, 2026.",
  "used_by": [
    "1914:decision-1914-09-08-hentsch",
    "1914:marne",
    "1914:historiography-hentsch-authority"
  ],
  "focal_point": { "x": 0.5, "y": 0.2 },
  "notes": "Provided by Dave 2026-08-22. The single image in the set that needs a fidelity check before it is used — the scene looks richer than a 387 × 600 bust portrait would support."
}
