{
  "$comment": "Provisional manifest — the Media entity schema (history-alive-y0u.2) will formalize these fields. Colorization is our own (AI-assisted, by Dave Tashner, 2026); original archive record still to be confirmed (history-alive-y0u.8).",
  "id": "media:person/schlieffen-alfred-von/portrait-c1906-colorized",
  "person": "person:schlieffen-alfred-von",
  "file": "portrait-c1906-colorized.png",
  "width": 1058,
  "height": 1487,
  "colorized": true,
  "original": {
    "description": "Studio portrait of Generaloberst Alfred Graf von Schlieffen in full dress uniform with Pour le Mérite, Order of the Black Eagle star and the Iron Cross; black-and-white photograph, 1906 — the year he retired as Chief of the General Staff (he was made Generalfeldmarschall in 1911).",
    "photographer": "Photo studio E. Bieber (Hamburg/Berlin)",
    "date": "1906",
    "archive": "Landesarchiv Baden-Württemberg (via Wikimedia Commons)",
    "archive_url": "https://commons.wikimedia.org/wiki/File:Alfred_von_Schlieffen_1906.jpg",
    "original_dimensions": "996 × 1400",
    "licence": "public domain — published before 1 January 1931 (Commons: PD in the United States; note the rule-of-the-shorter-term caveat outside the US)"
  },
  "colorization": {
    "author": "Dave Tashner / History Alive",
    "method": "AI-assisted colorization from the public-domain black-and-white original, 2026",
    "source_url": null,
    "licence": "History Alive project licence (same as the rest of the content); the underlying photograph is public domain",
    "status": "ok — label as 'colorized (AI-assisted)'; colour is interpretive except where documented (dark-blue Prussian tunic, gold epaulettes, black-and-silver Pour le Mérite ribbon)"
  },
  "content_policy": "ok — portrait, no gore",
  "caption": "Alfred Graf von Schlieffen (1833–1913), Chief of the German General Staff 1891–1906, author of the December 1905 memorandum. Colorized (AI-assisted) from a public-domain photograph.",
  "credit": "Original photograph: public domain (archive to confirm). Colorization: History Alive, AI-assisted, 2026.",
  "used_by": [
    "1914:prologue-origins",
    "1905:consequences-memorandum",
    "thread:road-to-1914"
  ],
  "focal_point": { "x": 0.5, "y": 0.28 },
  "notes": "Provided by Dave on 2026-08-22 for the Phase 1 prologue and the Person card. Hero image candidate for the prologue beat."
}
